Smell_Source	Smell_Word	Quality	Sentence	year	Book
s of a|of Ambergris|Musk|Glove	Effluvi|Effluvi|perfumed|perfumed|Effluvia|Odours	Effluvi|Effluvi|perfumed|perfumed|such	Leaving to Sophroni ∣ us the management of a Point hehas studied , and which I have not now time solemnly to Argue ; Ishall only tell you in general that Isee no necessity , That Intelligibilityto a humane Understanding , shouldbe necessary to the Truth or Exist ∣ enceof a thing ; any more thenthat Visibility to a Humane Eye , should be necessary to the Exist ∣ enceof an Atome , or of a Cor ∣ puscleof Air , or of the Effluvi ∣ um ' s of a Loadstone , or the Fra ∣ grantExhalations of Ambergris , and Musk from a perfumed Glove ; I might here observe , that evenby the same Sence some Creaturesmay discern things that may notbe perceptible to others : as no at ∣ tentionor application of the Organ ( or the Nose ) will inable a man toperceive the Effluvia expiringfrom the stale Footsteps of a hunt ∣ edand unseen Hare or Dear , tho ' Hounds , and especially Blood ∣ hounds , will have a vivid Precep ∣ tionof such Odours , and by theirhelp , trace and persue the flyingand unseen Beast .	1681	ee013284
Glove|its	perfume	strong	The thing succeeded as she had desir ' d , for after the Pilgrim had taken up the Glove , and found by its strong perfume , that it did not belong to an ordinary hand , he lifted up his head , and perceiv ' d some body that did make him signs , as if they would have him to stay , a little af ∣ ter which they withdrew .	1681	ee013662
The|of Gloves	Perfumer		15 The French Perfumer of Gloves and Snuff , & amp ; c .	1695	ee013700
Gloves	Perfumes		We travail all day through Dirt , and through Mire , To tetch you fine laces and what you desire , To Pains we do spare , to b ing you Choice Ware , As Gloves , and Perfumes , and sweet Powder for hair .	1685	ee058133
gloves|fans|tobacco|it	scent|perfuming		: also how to colour and scent gloves and fans , together with the secret of cleansing tobacco and perfuming it for all sorts of snuff , Spanish , Roman , & amp ; c .	1696	ee059431
Gloves|Fans	Scent		ALSO How to Colour and Scent Gloves and Fans .	1696	ee059431
Gloves	Perfumed		Treatise of Perfumed Skins and Gloves .	1696	ee059431
for Gloves or Skins|with Flowers|with Musk	Perfuming|Perfumes|Perfume|Perfumes		100 The Manner of Perfuming and Preparing Gloves 101 Perfumes for Gloves or Skins , before you Perfume them with Flowers 102 Perfumes made with Musk .	1696	ee059431
Spanish|Gloves|Skins	Perfume|Perfumed		106 Spanish Perfume 107 Perfumed Gloves or Skins with Amber 108 Preparations to Oyl Gloves on the wrong side 109 The Manner of Colouring Skins and Gloves 110 Mixture of Colours .	1696	ee059431
Gloves|Skins	perfume		Of Preparations to perfume Gloves or Skins .	1696	ee059431
Gloves	Perfumed		A Treatise of Perfumed Skins and Gloves .	1696	ee059431
Gloves|Skins	Perfume|Perfume		How to Perfume Gloves or Skins before you Perfume them with Flow ∣ ers .	1696	ee059431
Orange - flower -|your|your Gloves	Perfume		Warm the little Mortar , and melt a Gros of Amber , diluted with four Drops of Essence of Amber , being well infu ∣ sed and melted , pour to it a little of Mil ∣ lefleur - water ; then put your Musk and Amber in the Mortar , mix them very well together with the Pestle , pouring a Spoonful of Gum Arabick - water ; fill your Mortar with Orange - flower - water to the quantity of half a Pint , and when you will Perfume your Gloves , put the Mortar over a Chafing - dish of Fire to keep it warm , and use it as before .	1696	ee059431
of Gum|Gloves|Skins	Perfume		Grind one Gros of Musk upon a Mar ∣ ble , with four or five Drops of Millefleur water ; being well mixt put it by ; then warm pretty well the little Mortar , and melt two Gros of Amber , with half a Spoonful of Millefleur - water to dilute it ; being melted and mixt with that Water , put to it your Musk , and mix them all very well together with the Pestle , pour ∣ ing over it half a spoonful of Essence of Cloves ; pour more of the same Water , and fill your Mortar to the quantity of half a Pint , add to it two Spoonfuls of Gum Arabick - water ; when you use that Composition wash it over a Chafing - dish , and Perfume your Gloves or Skins .	1696	ee059431
Gloves|Gloves|with Amber	Perfumed		Perfumed Gloves and Skins with Amber .	1696	ee059431
of Linnen Wollen|Gloves	Perfumes		In Perfumes of Linnen Wollen , Gloves , & amp ; c .	1682	ee04002
of Orange Gloves	scent		I have been looking over the last Present of Orange Gloves you made me ; and methinks I do not like the scent .	1680	ee04482
Gloves|they	smell	so sweet	You are merry ; but when I send you Gloves from his Wedding , they will not smell so sweet as those you expected from Don Thomaso ; But I would gladly know where Don Alphou ∣ so gave you this Commission .	1664	ee04587
Gloves of a poisoned	Perfume		Some said by Bunches of Grapes given him to eat ; some by Gloves of a poisoned Perfume , presented him .	1677	ee05725
Gloves	perfum ' d|scent	too strong	My Band was broad , my ' Parrel was not plain , My Points and Girdle made the greatest show ; My Sword was odious , and my Belt was vain , My Spanish shooes was cut too broad at toe ; My Stockings light , my Garters ty ' d too long , My Gloves perfum ' d , and had a scent too strong .	1661	ee010409
My Gloves	scent		Gone was my Sword , my Belt was laid aside , And I transform ' d both in looks and speech ; My Parrel plain , my Cloak was void of pride , My little Skirts , my met a morphos ' d Breech , My Stockings black , my Garters were ty ' d shorter , My Gloves no scent ; thus march ' d I to her Porter .	1661	ee010409
of Per ∣|Gloves	Scent|fumed		But the splendour of the Nuptials were Eclipsed by the Death of Prince Henry the Kings Eldest Son ; which happened a little before the Weding , not without su ∣ spicion of Poison , as some have it , by the Scent of Per ∣ fumed Gloves , others by eating a Bunch of Grapes ; but the Disease affecting mostly the Brain , it carried him off in Five Days , tho ' the Physitians gave out he dyed of a Malignant Fever .	1696	ee02070
bonds|Gloves|White - washes	Perfumes		No faith , I have not sold Perfumes , Rib ∣ bonds , Gloves , White - washes , and other sorts so long , but I know how to make my self agreeable as well as any of my Customers : Nor have I follow ' d Tunbridge and Epsom , and sometimes Islington Wells so long , but that I know how to gain more hearts , as well as secure a perfect inclination , even I believe to the loathing of any other person .	1689	ee02418
pair of sweet Gloves	Smelling|smell	bad	And we plainly discoveredthat God had restored at that instant thesenses of Hearing , Seeing , Smelling andHandling , for when we called her by hername , she had an expression , whereby weperceived she heard us , as also that she sawus , and there was a pair of sweet Gloves , andwe bad her smell at them , and she put themto her Nose several times ; and she had atthat time much use of her hands , which shehad not before .	1652	ee014585
of a Spanish Glove	Effluvia|Perfume	thefragrant|strong	Thus we see , thatin many Hysterical Women , by thefragrant Effluvia of a Spanish Glove , or some Other strong Perfume , theSpirits and Genus Nervosum being af ∣ fected , several disorderly Symptomsare produc ' d , and oftentimes theMotion of the Blood is so stopt orabated , that any Pulse at all is scarce ∣ lyto be felt , nor Respiration dis ∣ cern ' d , and the whole Engine , una ∣ bleto sustain itself , falls to theGround , and lies moveless on It ; and yet we have often , by barelyholding to the Patient ' s Nostrils aVial full of very strong Spirit , orVolatile Salt , or Sal - armoniack , orof Harts - horn , in less than a quarterof an Hour , sometimes in a few Mi ∣ nutes , restor ' d Women in that Con ∣ ditionto their Senses , Speech andMotion .	1685	ee015834
Gloves|they|him	smell	sweet	I have but newly entertain ' d a Servant , that gave me these Gloves , they smell of him still , a sweet Courtyer .	1633	ee033859
of a pair of persum ' d Gloves	scent	venomous	But before the Nuptials were Celebrated , the Queen of Navarre ( being then at the Court of Paris , pro ∣ viding all things necessary for the wed ∣ ding - Solemnity ) was poison ' d by Renat , an Italian , the King ' s Apothecary , with the venomous scent of a pair of persum ' d Gloves ; by whose unnatural death , the Kingdom descended to the said Henry , precontracted to the King ' s Sister .	1684	ee018017
Gloves|Fans	Scent		Also how to Colour and Scent Gloves and Fans .	1698	ee018172
of a pair of persum ' d Gloves	scent	venomous	But before the Nuptials were Celebrated , the Queen of Navarre ( being then at the Court of Paris , pro ∣ viding all things necessary for the wed ∣ ding - Solemnity ) was poison ' d by Renat , an Italian , the King ' s Apothecary , with the venomous scent of a pair of persum ' d Gloves ; by whose unnatural death , the Kingdom descended to the said Henry , precontracted to the King ' s Sister .	1687	ee018173
fox|gloves|gladdon|alheal|butter	stinking|stinking	stinking|stinking	Flegm to purge , bryony , butchers - broom , daffedil , dodder , feverfew , fox - gloves , fumitory , stinking gladdon , endive , suc ∣ cory , birthwort , hawk - weed black hellebore , henbane , hissop , holly - berries , bind - weed , alheal , butter - wort , elder - buds .	1671	ee018958
Gloves	Perfume		An Excellent way to Perfume Gloves , is this .	1687	ee019940
powder|Gloves	perfume	notable	TAke oyle of Almonds of the sweetest , and put it into a pot with these powders , a little Musk , a little Storax , Callamintum , Nutmegs , Gilliflowers , and make them in powder , put them into the Oyle of Almonds , and set it to dry in the Sun in a Glass by the space of eight daies , and stir it with a stick every day then wet your Gloves in Rosewater three times , and let them dry again , and the last time when they are dry , annoint them with the Oyle and powder after it hath stood eight daies in the Sun , and your Gloves shall have a notable perfume ▪ For the Pin and the Web .	1655	ee051445
for Gloves	Perfumes		Perfumes for Gloves .	1655	ee051445
Gloves	perfume		To perfume Gloves .	1655	ee051445
Gloves	perfume	very	And grind it small , and lay it with your finger upon the turning down of the Gloves , and so dry them alwayes in your bosome ▪ To perfume Gloves very well .	1655	ee051445
for Gloves	Perfume		Another Perfume for Gloves .	1655	ee051445
for Leather|for Gloves|Amber - paste	Perfumes|perfume|perfume|perfume|Perfumes|perfume	sweet	45 A Water to wash the face 45 Perfumes for Leather ibid Another perfume 459 Another perfume — ibid A sweet perfume to burne 460 Perfumes for Gloves ibid A perfume called Amber - paste .	1655	ee051445
King Edwards|The French Queens|for Gloves|for Gloves|for Gloves|for Gloves	perfume|perfume|perfume|perfume|perfume|perfume|perfume|perfume|perfume|perfume|perfume	fine|excellent|sweet|special	ibid King Edwards perfume — ibid The French Queens perfume ibid Another fine perfume ibid Another excellent perfume ibid Another perfume — 462 A sweet perfume 463 A special perfume for Gloves 464 Another perfume for Gloves ibid Another perfume for Gloves — ibid Another perfume for Gloves ibid The Receipt for the former perfume — 465 Another receipt for the same ibid To make an excellent Pomander .	1655	ee051445
of a pair of Gloves	perfume		The first thunderbolt of so great a tempest fell upon the Queen of Navarre ; who be ∣ ing a Woman and a Queen , they thought fittest to take her away by poison , admini ∣ stred as was reported in the perfume or trimming of a pair of Gloves ; but in such se ∣ cret manner , and in such just proportion , that having worn them a while , a violent Feaver seised upon her , which ended her life within four days .	1678	ee020173
of a pair of perfumed|perfumed|perfumed Gloves	smell|perfumed|perfumed|perfumed	venomed|perfumed|perfumed|perfumed	it hath been found that she was poysoned with a venomed smell of a pair of perfumed Gloves , dressed by one Renat , the Kings Apothecary , an Italian , that hath a Shop at Paris upon S i t Michaels Bridge , neer unto the Pallace ; which could not be espyed by the Physitians , which did not open the head , nor looked into the Brain .	1642	ee020732
sweet powder|Garments|Gloves	perfume		There is much hereof spent in sweet powder , and sweet washing waters , and to perfume Garments , Gloves , & amp ; c .	1640	ee021708
gloves	perfume		To perfume Garments , gloves , & amp ; c .	1640	ee021708
His|his|Gloves|Cravat	Smelt	sweet	His Wig , and his Handkerchief , Gloves and Cravat , Smelt sweet as the Arse of a Muscovie - Cat .	1699	ee054821
they|Gloves	scent	of the richest	Away , thou ' rt a Fool , and knowst not what Thou hast refus ' d : they are , I tell thee , Gloves of the richest scent ; besides , each Finger ' s Lin ' d with Gold ; here , wear ' em for my sake .	1697	ee042322
Those Gloves|their	scent|smell	rich soe|sweet|strong|deadly|most|most	Those Gloves , How rich soe ▪ er and sweet their scent may seem , Yet once well heated on the Hand , will cast a strong And deadly smell , most fatal to the Brain , a Poyson Not only certain , but strangely sudden in its operation , As I was told , at least , by an Italian famous in that hellish Art , from whom I had ' em .	1697	ee042322
gloves|they|their	perfumed|perfumed|perfumed|perfumed|perfume|perfumed	perfumed|perfumed|richly perfumed|perfumed|much more valuable	Tis with the blessings of this life , as tis with perfumed gloves , when they are richly perfumed , their perfume is much more valuable then the leather , wherof they are made ; So not so much earthly blessings considered in themselves , as their being perfumed with the sweet love of God in Christ , is that which maketh them blessings in ∣ deed , truly deserving the name they bear .	1659	ee042481
for Gloves	Perfume		A Perfume for Gloves .	1656	ee043854
for Gloves	Perfume		Another Perfume for Gloves .	1656	ee043854
a paire of Gloves	perfume		And when you will perfume a paire of Gloves , take a little fair water in a spoon , and wipe your Gloves very fine with it .	1656	ee043854
pomatum|gloves|wash|balls|toilette|boxes|with bergamot|bergamot	perfumes|bergamot|bergamot		This place is famous for its pomatum , gloves , wash - balls , perfumes , and toilette - boxes , lined with bergamot .	17XX	ec626
gloves	scented|scented	scented|scented	A few indeed were hardy enough to try a fall with him : but most of our young fellows gave up the gauntlet for scented gloves ; and loathing the mutton fists of vulgar carmen and porters , they rather chose to hang their hands in a sling , to make them white and delicate as a lady ' s .	17XX	ec2635
Cyprus|Gloves|Bugle bracelets|necklace	Perfume	sweet	Lawn as white as driven snow , Cyprus , black as e ' er was crow ; Gloves , as sweet as damask roses , Mask for faces and the noses ; Bugle bracelets , necklace amber , Perfume for a lady ' s chamber ; Golden coifs , and stomachers , For my lads to give their dears : Pins , and poaking sticks of steel , What maids lack from head to heel : Come buy , of me come ; come buy , come buy , Buy lads or else your lasses cry .	17XX	ec1591
Gloves|Bugle bracelets|necklace	Perfume		Lawn , as white as driven snow , Cyrus , black as e ' er was crow ; Gloves , as sweet as damask roses , Masks , for faces , and for noses ; Bugle bracelets , necklace amber , Perfume , for a lady ' s chamber ; Golden coifs , and stomachers , For my lads to give their dears : Pins , and poaking - sticks of steel , What maids lack from head to heal : Come buy of me , come ; come buy , come buy , Buy lads , or else your lasses cry .	17XX	ec1647
burnet - rose|gorse|sea - campion|a few foxgloves	scented|scented	sweetly - scented|scented	The banks are gay with thrift , vernal squill , the sweetly - scented burnet - rose , gorse , sea - campion , and a few foxgloves ; and I saw some dwarf bluebells and the lady ' s - fingers ( Anthyllis ) .	1902	wi8119
cosmetics|gloves	perfumes|scented|scented	scented|scented	Silk stockings amongst other things , such as cosmetics , face washes and perfumes , and embroidered and scented gloves , and fans made of ostrich or peacock feathers with gold and silver handles , were adopted by the men as well as by the women .	1906	wi8169
their White Gloves|of Gasoline	smelling		All the Young Men in this Reub Town wore Derbies with their Evening Clothes and came to Dances with their White Gloves smelling of Gasoline , in addition to which they lacked Repose .	1903	wi8287
gloves|his hair|his cravat	scents	Such	Such scents ! such gloves ! And then his hair and his cravat ! ' ' Now , papa , you are not fair .	1865	wi26607
gloves	scented|scented	scented|scented	When he issued from the powder - room in his gold - laced uniform , with scented gloves and carefully - adjusted queue , he presented the image of a young gentleman so clearly equal to the most flattering emergencies that Alfieri broke into a smile of half - ironical approval .	1901	wi4263
gloves	perfumes|perfumed|perfumed	perfumed|perfumed	Oh , Frank ! Frank ! have you come out on purpose to break the hearts of all Bideford burghers ' daughters ? And if so , did you expect to further that triumph by dyeing that pretty little pointed beard ( with shame I report it ) of a bright vermilion ? But we know you better , Frank , and so does your mother ; and you are but a masquerading angel after all , in spite of your knots and your perfumes , and the gold chain around your neck which a German princess gave you ; and the emerald ring on your right fore - finger which Hatton gave you ; and the pair of perfumed gloves in your left which Sidney ' s sister gave you ; and the silver - hilted Toledo which an Italian marquis gave you on a certain occasion of which you never choose to talk , like a prudent and modest gentleman as you are ; but of which the gossips talk , of course , all the more , and whisper that you saved his life from bravoes — a dozen , at the least ; and had that sword for your reward , and might have had his beautiful sister ' s hand beside , and I know not what else ; but that you had so many lady - loves already that you were loth to burden yourself with a fresh one .	1855	wi23501
of the gloves	inhaled|odour		He stepped twice on each step , the better to enjoy their effect and at the same time he deeply inhaled the odour of the gloves .	1914	wi13027
Kate ' s glove|it	smell		He took out Kate ' s glove , which the wolf had brought to him in the willows , and allowed him to smell it .	1919	wi13906
Polish|gloves	scent		And this sum was not only sufficient for his board and lodging , but even for such luxuries as an overcoat lined with Polish beaver , gloves , scent , and photographs ( he often had photographs taken of himself and used to distribute them among his friends ) .	1916	wi12372
of his hand or glove	smell		When she met a person whom she had met before she instantly recognized him by the smell of his hand or glove .	1877	wi651
his hand|his hand|his glove	smelled|impression|smelling	so strong	If it were a stranger she smelled his hand , and the impression was so strong that she could recognize him long after by again smelling his hand , or even his glove , if just taken off .	1877	wi651
one glove|it|the hand of each	smell|smell		If half a dozen strangers should throw each one his glove into a hat , and they were shaken up , she would take one glove , smell it , then smell the hand of each person , and unerringly assign each glove to its owner .	1877	wi651
fox - glove	smell	peculiar	fox - glove have a bitter nauseous taste , but do r > ss any peculiar smell : I have long been used with consick ar - able advantage , in the preparation el an ointnn nt for sores aud scro - phulous tumors .	1802	wi18796
a woman ’ s glove	fragrant|fragrant	fragrant|fragrant	”   But upon the icy slab lay a woman ’ s glove still warm and fragrant .	1895	wi18903
of kid gloves|of flowers	smell|scent	strong	The smell of kid gloves mingled with the strong scent of flowers .	1920	wi22711
Lavender|apparrell|gloves|leather	perfume		Lavender is little used in inward physicke , but outwardly ; the oyle for cold and benammed parts , and is almost wholly spend with us for to perfume linnen , apparrell , gloves , leather , & c .		wi17077
dish of roses|a|pair of|gloves of Martial	scented|scented	scented|scented	A dish of roses , a few French romances , a manteau girdle , a copy of the Annus Mirabilis of Dryden , a pair of scented gloves of Martial , and a cittern in the corner completed the gently bred disorder of the room .	1903	wi15327
gloves|stockings	perfumes		Manufactures of silks , perfumes , gloves , stockings , and caps — the last three made from the byssus of the Pinna iq .	1921	wi3127
rose|glove	scented|scented	scented|scented	They , too , had killed , at joust and tournament , so that the lady of their desire would toss them rose or scented glove from tapestried balconies .	1925	wi3601
Gloves|of violets	odour	the faintest	""""""" Gloves , if you please ! — a stack of them with I can ' t tell you how many buttons , and the faintest odour of violets ."""	1919	wi20597
gloves	scent		Dull northern brains , in these deep arts unbred , Know nought but to cut throats , or knock o ' th ' head ; No sleight of murder of the subtlest shape , Your busy search and observation ' scape ; Legerdemain of killing , that dives in , And juggling steals away a life unseen ; How gaudy fate may be in presents sent , And creep insensibly by touch , or scent ; How ribands , gloves , or saddle - pommel may An unperceived , but certain death convey , Above the reach of antidotes , above the power Of the famed Pontick Mountebank to cure ; Whate ' er is known to quaint Italian spite , In studied poisoning skilled , and exquisite , Whate ' er great Borgia , or his sire could boast , Which the expense of half the conclave cost .	1854	wi11655
of hot - house flowers|kid gloves	scent		And then there was a sound of children ' s voices and laughter as they all came trooping in , with a crisp rustle of delicate dresses and a scent of hot - house flowers and kid gloves that reached Dandy where he lay ; it reminded him of long ago , when Hilda had had parties and he had been washed and combed and decked out in ribbons for the occasion , and children had played with him and given him nice things to eat — they had generally disagreed with him , but now he only remembered the petting and pleasure of it all .	1892	wi6654
gloves	scented|scented	scented|scented	Should I imprison in my hand that little hand with the dangling , scented gloves which had just tapped my lips ? Should I dare to kiss her there and then , or slip my arm around her waist ? Or dared I even sit closer ? Well , I didn ' t dare .	1913	wi29170
a|glove|a dead flower	scented|scented|smell	scented|scented	Never have I been much of a ladies ' man , being more concerned with fighting and kindred arts which have ever seemed to me more befitting a man than mooning over a scented glove four sizes too small for him , or kissing a dead flower that has begun to smell like a cabbage .	1918	wi5889
double|single peonies|poppies|larkspur|fox - glove|clove pinks|phlox|their	fragrance		Painted so you can call them by name : double and single peonies , poppies , larkspur , fox - glove , clove pinks and phlox — you can almost catch their fragrance .	1900	wi7033
gloves	perfumes		The seventeenth earl , a courtier and poet , at the court of Elizabeth , did not disdain to introduce gloves and perfumes into England .		wi7610
gloves|green|morocco shoes	perfumed|perfumed	perfumed|perfumed	The perfumed gloves , red , green , and sky - blue stockings , and morocco shoes of different colors , also continued to be the fashion .	1877	wi7908
Gloves	perfume	faint	You should have seen him in the street Of the little Boston of Winthrop ' s time , His rapier dangling at his feet Doublet and hose and boots complete , Prince Rupert hat with ostrich plume , Gloves that exhaled a faint perfume , Luxuriant curls and air sublime , And superior manners now obsolete ! He had a way of saying things That made one think of courts and kings , And lords and ladies of high degree ; So that not having been at court Seemed something very little short Of treason or lese - majesty , Such an accomplished knight was he .	1863	wi14216
This glove	odor	irreproachable	This glove , wherever it had not touched the muddy ground , was of irreproachable odor .	1844	wi14867
gloves	perfumed|perfumed	perfumed|perfumed	It was one of those perfumed gloves that lovers like to snatch from a pretty hand .	1844	wi14867
of your gloves	fragrance|perfume|It	singular|faint|delicious|agreeable	""""""" """" By the by , """" said the professor , looking uneasily about him , """" what singular fragrance is this in your apartment ? Is it the perfume of your gloves ? It is faint , but delicious ; and yet , after all , by no means agreeable ."""	1854	wi14980
his water -|his wall -|autumn garden|its|of foxgloves|of mignonette	fragrant|fragrant	fragrant|fragrant	""""""" She eulogizes his green Indian corn , his Carolina beans , his water - melons , and his wall - fruit ; and concludes by declaring that she """" never saw a more glowing or a more fragrant autumn garden than that at Botley , with its pyramids of hollyhocks , and its masses of China asters , of foxgloves , of mignonette , and of varied geranium ."""		wi10649
