Smell_Source	Smell_Word	Quality	Sentence	year	Book
of black gloves and funeral flowers	smell	sickly	above was empty with that emptiness only a funeral can leave , and the mournful , little party of guests had departed , and he sat in the dining - room , that was pervaded with the sickly smell of black gloves and funeral flowers , and tried to re - arrange his life ' s programme .	1894	bl0827
gloves	fringed|fringed|scented|scented	fringed|fringed|scented|scented	' You ken I ' m going to be married , Ailie , ' said Babby complacently and tentatively , while she played with her fringed and scented gloves , and looked out of the corners of her crafty eyes at Ailie .	1895	bl03365
Bags|Bottles Chatelaines|Cigars Cases Inkstands|Blotters Glove	Smelling		Bags , Smelling Bottles Chatelaines , Cigars Cases Inkstands , Blotters Glove & amp ; Handkf .	1890	bl03432
of some gloves	scent		96 OLD TOURAINE suddenly and died — of a pleurisy , so it was given out ; but rumours were persistently spread that her death was owing to the scent of some gloves skilfully prepared by Rene , the Queen ' s Florentine perfumer ; and these reports gained credence from the fact that Ambroise Pare , in his examination of the body , was forbidden to look at the brain , the sole organ that Rene ' s poisons would have touched .	1898	bl03490
glove|photo|perfume	odour	delicious delicacy	Firstly , he recalled a particularly brilliant tunnel with a row of lights along the centre of its domed roof ; upon each side a sequence of dazzling shops , chiefly glove , photo and perfume shops — the last pervading the atmosphere with a delicious delicacy of odour ; a crowd of especially well - dressed men and women , apparently all more or less acquainted with each other ; men ' s silk hats gleaming refulgent in the refractions of light from shops and roof ; a sudden meeting with Mr .	1892	bl03985
Their|deep|Of purple clover|the foxglove	mystic|mystic essence|breath|scent	mystic|mystic	Thus Spring sped past me , singing as she went , While flow ' rs sprung up more thickly in her track And glowed more richly , and the brimming brook Grew broader as it neared the woodland ' s marge , Where fir - trees here and there let in the blue Which bent above them , and diffused afar The subtle mystic essence which the sun Distils from their young branches ; and I thought Their breath pursued me as I reached the wide , Warm , basking meadows of full summertide , Where splendid poppies burnt like balls of fire Amid the knee - deep grasses , and the scent Of purple clover lured the dusty bees From their sweet quest among the foxglove bells And meadow - sweet along the river bank ; For now the brook had broadened , and become 5 3n tbe XTCloobs .	1897	bl03992
a bunch of ribbons|pair of gloves	perfumes		He was full of natty ideas for giving Dewence pleasure — a bunch of ribbons , a pair of gloves , perfumes , and endless nick - nacks ; as far as his cash would permit he was always bringing her gifts of this kind .	1896	bl011010
glove	scented|scented	scented|scented	wore , The wee , scented glove set my heart afresh bleeding , But leave them untouched as she left them of yore .	1895	bl011228
of her glove	perfume		The perfume of her glove lingered yet upon his hand as he passed it across his face .	1891	bl011422
Bath Gloves|Friction Gloves|Brushes|Tooth Brushes|Nail Brushes|Hair Brushes|Perfumes|Perfumes|Fine Old English Lavender Water|Hygienic Skin Soap|Metal Soap Cases|Blue Bells of Scotland Bouquet	Perfumes|Perfumes|Perfume		Also Bath Gloves , Friction Gloves and Brushes , Tooth Brushes , Nail Brushes , and Hair Brushes , Perfumes , Fine Old English Lavender Water , Hygienic Skin Soap , Metal Soap Cases , the New Delightful Perfume , Blue Bells of Scotland Bouquet , and every Toilet Requisite of Best Quality .	1889	bl011467
glove|glove	scented|scented	scented|scented	Drawing off her scented glove she gave me her jewelled hand , which was very white and shapely , to kiss .	1896	bl011836
gloves|of benzine	smell	horribly	Ought I to wear my new Bertha , do you suppose ? And about gloves ? My only evening pair are long past mending , and smell horribly of benzine .	1890	bl011920
of honeysuckle|dog - roses|moon - daisies|tall foxgloves|feathery grasses	perfume		The day was hot and sultry , the air heavy with the perfume wafted from the hedgerows , now in their fullest bloom , and filled with a rich profusion of honeysuckle , dog - roses , moon - daisies , tall foxgloves , and feathery grasses .	1896	bl011977
The|The red|red and white|the foxglove	scent	pleasant	The red and white campions send out a pleasant scent , and the foxglove , that has a pleasing record with boys , and countless others , bloom .	1892	bl06109
gloves|stockings|hair|brushes|bottles	scent -		A man by himself , for instance , cannot easily select a hat for a woman , or a jacket , or boots , though he can easily send her gloves , stockings , hair - brushes or scent - bottles .	1897	bl06364
its|gloves	perfumes|perfumed|perfumed	perfumed|perfumed	Grasse , indeed , has always been known for its perfumes , and especially for its perfumed gloves , which were as famous in their own day as the leather of Cordova .	1892	bl06601
of some gloves	scent		96 OLD TOURAINE suddenly and died — of a pleurisy , so it was given out ; but rumours were persistently spread that her death was owing to the scent of some gloves skilfully prepared by Remf , the Queen ' s Florentine perfumer ; and these reports gained credence from the fact that Ambroise Pard , in his examination of the body , was forbidden to look at the brain , the sole organ that Rene ' s poisons would have touched .	1892	bl06701
from new mown fields|of the woodbine|wild rose|fern|foxglove|many other flowers	scent|perfume	delicious	It is the time of haying ; the scent from new mown fields , and the perfume of the woodbine and wild rose are delicious ; whilst fern and foxglove , and many other flowers , add to its charms .	1892	bl02488
Gloves|sachets of Spanish leather full|herbs	scent		Gloves and fans innumerable , with bottles of scent from Targeon , sachets of Spanish leather full of herbs from Montpellier .	1890	bl02668
waters|gloves|stocking|caps	scented|scented	scented|scented	It has a fine archiepiscopal cathedral , and manufactures silks , scented waters , gloves , stocking , and caps .	1895	bl02907
kid - glove life	scented|scented	scented|scented	' ' Nature suits its life to the surroundings , ' said Brice earnestly ; ' these young men , I suppose , are framed to combat a scented kid - glove life , whilst we in our New World are easily overcome by what seems to them perfectly natural to everyday life .	1893	bl02967
of gloves|ribbons|laces|fans|things	scent		' The favourite places of resort in the City were the galleries of the Royal Exchange , filled with shops for the sale CHARLES THE SECOND 321 of gloves , ribbons , laces , fans , scent , and such things .	1892	bl02971
her|kid gloves|her cambric handkerchief	perfume|scented|scented	scented|scented	She was more intent on admiring the silken folds of her Aunt ' s dress , and revelling in the perfume of her scented kid gloves , and of her cambric handkerchief trimmed with lace .	1896	bl05319
of your gloves	fragrance|perfume|It	singular|faint|delicious|agreeable	I marvel Iioav your Avorship finds time to read such nonsense among your graver said the professor , looking uneasily uneasily about him , what singular fragrance is this in your apartment ? Is it the perfume of your gloves ? It is faint , but delicious ; and yet , after all , by no means agreeable .	1892	bl05467
The yellow Alpine foxglove|allspice	scented		The yellow Alpine foxglove was growing there in great beauty , and a flaming allspice , which I have never seen before , scented the whole air of the garden .	1893	bl05584
tropical flowers|bottles|packets of pale kid gloves	scent		To say nothing of the sumptuous supper and costly decorations of the room , there towered on all sides huge groves of tropical flowers , and pyramids of the finest bonbons ; while in the ladies ' toilet apartments rows of scent bottles , packets of pale kid gloves , and dozens of satin shoes , pink , blue , and white , stood ready ranged to meet any emergency that could possibly arise .	1891	bl01274
glove|broidered shoe	scented|scented	scented|scented	And lest too bright your beauty shine , Fling over all , fair daughter mine , A wimple of golden tissue free , A faery mist from head to O father , what have I to do With scented glove and broidered shoe ? Lovely robe and precious gem , What have I to do with them ? All I had I have sold to give Wherewith to bid the people live .	1899	bl01583
glove|the broidered	scented|scented	scented|scented	Bid your ladies bring for you The scented glove and the broidered shoe ; 11 Even the soul where God did see The very self of Charity .	1899	bl01583
gloves	perfumes		The French storekeepers bid eagerly for wares of European manufacture , the French planters sent their slaves down in dozens to purchase purchase luxuries only attainable from beyond sea , while the negroes , grinning from ear to ear , jostled and scolded each other in their desire to barter yams , plantains , fruit , poultry , and even , on occasion , pieces of actual money , for scarfs , gloves , perfumes , and ornaments — the tawdrier the better , which they thought might add to the gloss of their black skins , and set off their quaint , honest , ugly black faces to advantage .	1898	bl01604
the greensward|their|the foxglove	scent	delicate|more delicate	In early summer the greensward is gemmed with millions upon millions of hyacinths , with their delicate blue and more delicate scent ; later will come the foxglove in like profusion .	1894	bl01630
buttercups|foxgloves	scents	balmiest	How lovely are these woodland ways Clad in their summer dress , Where come not din and smoke to mar Their evening loveliness ; Where wild - rose and convolvulus Are wov ' n in every hedge , And buttercups and foxgloves glow By this clear brooklet ' s edge ; Where breezes waft their balmiest scents Adown the silent wood , And scarce a songster sings to break The hush of soUtude ; h 98 In Ellington Copse .	1899	bl01706
gloves	fragrant|fragrant	fragrant|fragrant	192 cloth , with his hands encased in fragrant gloves , getting out of a coach , called by kings , or sought by queens , in request by honest dames , applauded by magnates , and carried in triumph by all the people on the earth .	1893	bl01885
flowers|roses|lilies|fox - gloves|sweet|little wild blossoms|geraniums	scented|scented	scented|scented	There had been flowers of every description , roses and lilies , fox - gloves , sweet , little wild blossoms out of the hedgerows , scented geraniums , and deep - hued heart ' s - ease , all for the feet of Kate to touch as she passed down the path between the crumbling gravestones of the peaceful dead .	1897	bl01972
he|of civet|something|gloves|mous	smells	equally abominable	A homeward fever parches up my tongue — O let me cool it ' mong the zephyr boughs ! A homeward fever parches up my tongue — O let me slake it at the running springs ! The King is dead — long live the King ! It is a very little king who comes stepping towards us across the lawn from which the morning dew is not yet brushed ; he smells of civet , or something equally abominable ; wears gloves and mous tachios , and a hat that he might have stolen from Mr Titmarsh .	1894	bl07081
flowers|fruits|gloves	perfumes		So he undertook with alacrity to ride over twice a week from Carleen , and instruct this droll maiden in the science of Æsculapius , bringing to her feet , in place of the customary offerings of manhood , — flowers , fruits , gloves , perfumes , and a manly heart , — his collection of bones and medical books .	1892	bl07461
of some gloves	scent		96 OLD TOURAINE suddenly and died — of a pleurisy , so it was given out ; but rumours were persistently spread that her death was owing to the scent of some gloves skilfully prepared by Rene , the Queen ' s Florentine perfumer ; and these reports gained credence from the fact that Ambroise Pare , in his examination of the body , was forbidden to look at the brain , the sole organ that Rene ' s poisons would have touched .	1893	bl07488
of her gloves	scent		And yet here was everything as it had been when I was a child ; and all through the agency of this solid phantom of a lovely young English duchess , whose warm gloved hands I had only this minute been holding in mine ! The scent of her gloves was still in my palm .	1892	bl07534
my gloves	scent|smelt	strong	How about scent this morning , Sir Harry ? I shouldn ' t be surprised we run ; my gloves smelt strong this morning when I put them on .	1889	bl07572
fan|gloves	perfume		The startled woman accepted the splendid bouquet de corsage of Russian violets , but murmured , must be alone ! Leave me for a few moments ' rest ! I implore you , — leave me — Ernesto ! To - night I must be more than myself ! It is the turning point of my whole And the crafty Italian gazed greedily at the Khedive ' s gleaming crescents and stars , and left her in peace ! is her night of nights ! With such a woman , I can surely hold both Ismail and Cherif , — through her ! She is my treasure , — soon to be my queen of diamonds ! There is a fortune waiting for us here — and , — then , — a villa — within sight of Capri ! Yes ! I must hold la Morelli — as my money The singer was robed and ready for the grand entree ! Already the eager crowd of jealous gallants were listening listening for her footfall ! She dismissed her maid , and then craftily locked the doors ! Her diamond set , flaqon of perfume , her fan , gloves , and a queen ' s handkerchief lay ready on the table ! She drew from her bosom a little silken purse and then poured out upon the table a glittering shower of magnificent magnificent diamonds .	1898	bl07974
of the sweet briar|of the rose|foxgloves|foxgloves|flox|jasper	savour|scent	touching	There is a touching savour of quaintness in its very name that caUs up memories of old farm gardens , where the scent of the sweet briar mingles with that of the rose , and foxgloves , foxgloves , and flox , and jasper larkspur show their heads amidst currant bushes and raspberry canes .	1889	bl014238
foxgloves|polypodies	scents	sweet	' Tis beautiful now , but how much more beautiful in summer , when along the sides and in the chinks of it grow foxgloves , polypodies and the like , and the air is laden with sweet scents and the hum of insect life ! ' And now they entered the outskirts of the town , and the two parted , Owen thanking Ben most heartily for his company , and for his conversation which had brightened all the way .	1897	bl014620
gloves	perfumes		443 Their kid gloves and perfumes raise a jeer from the crowd , and often evoke some coarse chaff from the more rowdy element that is rollicking about the streets or roaring in the pubs .	1890	bl014646
gloves|of the Rose|Orange - blossoms|of the Violet and Cassia plant	perfumed|perfumed|ods|odours	perfumed|perfumed|essential	In the old days the wealth of the city came from its leather trade , and its perfumed gloves were as famous as the products of Cordova ; but the fiscal laws of the Revolution crushed its tanneries , and the energies of the natives have during this century been directed to the development of the means for seizing the essential ods of the Rose and Orange - blossoms ; in capturing the odours of the Violet and Cassia plant , and sending them to the four corners of the earth .	1891	bl014669
with full - blown roses|daisy|buttercup|harebell|foxglove|gorse|honeysuckle	odorous		But the neat little gardens in the village were already odorous with full - blown roses ; the stronger wildflower wildflower — daisy , buttercup , harebell , foxglove , gorse , honeysuckle — - were lovely in their profusion in field , and glen , and brae ; the haymakers were preparing to mow the hay in the vaUey below Hilltown ; by dawn and dusk the angler journeyed to and from distant loch and stream , with mountain health glowing in his cheek ; and the outdoor Use of the village , from groups of merry young people on the Common to the old men seated in the shade of the village trees , had reached its midsummer midsummer height of gleesome brightness .	1892	bl09114
boxes|gloves	nose|snuff|snuff		How many pocket handkerchiefs ? One , — devil a more ! You could only blow your nose two days in the week , and now you may every hour of the twenty - four ! And as to the trifling articles of small value , snuff - boxes , gloves , bootjacks , nightcaps , and — ' ' Stop , Tim , that ' s enough — ' ' No , sir , it is not , ' said Tim , drawing himself up to his full height ; ' you have wounded my feelings in a way I can ' t forget .	1892	bl09323
Bath Gloves|Friction Gloves|Brushes|Tooth Brushes|Nail Brushes|Hair Brushes|Perfumes|Perfumes|Fine Old English Lavender Water|Hygenic Skin Soap|Metal Soap Cases|Flowers of Scotland Bouquet	Perfumes|Perfumes|Perfume		Also Bath Gloves , Friction Gloves and Brushes , Tooth Brushes , Nail Brushes , and Hair Brushes , Perfumes , Fine Old English Lavender Water , Hygenic Skin Soap , Metal Soap Cases , the New Delightful Perfume , Flowers of Scotland Bouquet .	1890	bl09350
ferns|foxgloves|great clusters of starry primroses|of early hawthorn|late violets	perfume		There were ferns and foxgloves in the hedgerows ; great clusters of starry primroses filled the hollows , and the perfume of early hawthorn and late violets filled the air .	1892	bl09721
foxglove|jasmin|dog - rose|honeysuckle|sweet - pea|their|marigold	fragrance		34 were overgrown with moss and weeds ; the vegetation was luxuriant in its wild glory , where foxglove , jasmin , dog - rose , honeysuckle and sweet - pea mingled their fragrance and wealth of colour with forget - me - not and marigold marigold in hap - hazard delightful confusion .	1891	bl09779
Gloves	odour		Gloves cleaned daily , free from odour .	1895	bl09796
gloves|boot	snuff		How many pockethandkerchiefs pockethandkerchiefs ? One ; devil a more ! You could only blow your nose two days in the week , and now you may every hour of the twenty - four ! And as to the trifling articles of small value , snuff - boxes , gloves , boot - jacks , nightcaps , and ' ' Stop , Tim , that ' s enough ' ' No , sir , it is not , ' said Tim ; ' you have wounded my feelings in a way I can ' t forget .	1893	bl010025
fern|foxglove|a hundred exquisite weeds	perfume		The banks Avere hidden with fern and foxglove , and a hundred exquisite weeds delighted the senses with perfume and colour .	1890	bl010302
gloves|cigars|fine|handkerchiefs	perfumes	perfumes	Little presents — feminine he knew by the perfumes perfumes floating round them — gloves and cigars , fine handkerchiefs , handkerchiefs , and silks for wear , came to his barracks .	1889	bl010335
sticks|opera|glasses|gloves|ladies '|bottles|boxes of pills|other patent medicines	scent		If not claimed within two years , they are sold by public auction , and a pretty miscellaneous sale a railway auction is , consisting of coats , shawls , hats , caps , rugs , walking - sticks , umbrellas , parasols , opera - glasses , gloves , ladies ' scent - bottles , boxes of pills and other patent medicines , hair - dyes , and other articles .	1897	bl010357
Pears|Cleaver ' s|other Soaps|Tooth Brushes|Flesh Gloves|Mineral	Perfumes		Exquisite Perfumes , Pears ' , Cleaver ' s and all other Soaps ; Tooth Brushes , Flesh Gloves and 3 | g ! Mineral Waters in Great Variety - TIPPERARY .	1889	bl010358
the honeysuckle|its|blossoms|the harebell|the foxgloves|the ruddy sorrel	scented|scented	scented|scented	Herbage and foliage still wore that fresh green colour so characteristic of an English summer ; the honeysuckle was yet gay with its scented blossoms , and the harebell and the foxgloves , with the ruddy sorrel , and many another wild flower , grew thickly in the valley and down the grassy banks of the lovely river , its clear , crystal waters flowing on with a pleasant , soothing murmur .	1890	bl010398
knots|gloves	perfumes|perfumed|perfumed	perfumed|perfumed	Oh , Frank ! Frank ! have you come out on purpose to break the hearts of all Bideford burghers ' daughters ? And if so , did you expect to further that triumph by dyeing that pretty little pointed beard ( with shame I report it ) of a bright vermilion ? But we know you better , Frank , and so does your mother ; and you are but a masquerading angel after all , in spite of your knots and your perfumes , and the gold chain round your neck which a German princess gave you ; and the emerald ring on your right fore - finger which Hatton gave you ; and the pair of perfumed gloves in your left which Sidney ' s sister gave you ; and the silverhilted silverhilted Toledo which an Italian marquis gave you , on a certain occasion of which you never choose to talk , like a prudent and modest gentleman as you are : but of which the gossips talk , of course , all the more , and whisper that you saved his life from bravoes — a dozen , at the least ; and had that sword for your reward , and might have had his beautiful sister ' s hand beside , and I know not what else : but that you had so many lady - loves already that you were loth to burden yourself with a fresh one .	1896	bl010544
loomask|pulvil purse|gloves	scented|scented	scented|scented	A few French romances , the last plays of Etherege , Dryden , and Shadwell , a volume of Cowley , and some amorous songs , lay on the table ; and not far from them were a loomask , pulvil purse , a pair of scented gloves , a richly - laced mouchoir , a manteau girdle , palatine tags , and a golden bodkin for the hair .	1855	bl504044
Avhite kid gloves	odour	very superfluous|redolent	I tried to extract some information information on the subject from Johnny , but even my unrivalled skill In turning brains 278 CONFESSIONS OF in a semi - fossilized village , called , or at least spelt , Oughterard â   a whilome stronghold stronghold and capital city of the famous O ' Flaherties , in the Avilds of Connemara â   for no better reason than that upon opening a drawer in which lay some pairs of , alas ! very superfluous Avhite kid gloves , the odour , redolent of the white muslin paradises paradises of London , which it at once recalled to my mind in all their decollete glory , overcame overcame me ; and , as I say , I actually shed tears .	1852	bl504421
Fox - glove Fracture|Freckles|Guaiac|resin|worm guaiaci|Gum ammoniacum Gum|Frog|Fruit	Fragrance		; Groundsel Forgetfulness Fox oblivium vulpes senecio musuca Jac , ? lignum sanctum Fox - glove Fracture Fragrance Freckles digitalis purpurea fractura Guaiack Guaiac , resin Guinea - worm guaiaci , gummi dracunculus fragantia lentigo larynx gummi ll Gullet I Gum Frenzy ( phrenzy ) Fritillary cephalitis fritillarla ( cirrhosa ) rana esculenta Gum ammoniacum Gum arable ammoniacum Frog , edible Fruit arabicum , gummi fructus Gum of a date - palm Gums pbÅ  n .	1852	bl504508
gloves|hands|oil	perfumes		' Pas mal , Monsieur Leo - endre ! â   kid gloves and perfumes , Madonna hands , and Macassar oil , are costly things to deal That is really said Lady Hester .	1852	bl504658
hand|glove	perfume|scented|scented	imparting|scented|scented	Two sonnets , in particular , sing , in cadences of sweetest harmony , her hand imparting perfume to the scented glove , that enviously veiled , from her minstrel ' s greedy eyes , a Avhiteness before which the snow would blush , and her bosom , the garden of love , the paradise of the poet , its ripened charms surpassing the budding beauties of early spring .	1851	bl5071
fringed gloves	scented|scented	scented|scented	In his yellow skeleton hands he held a pair of scented , fringed gloves , which he declared in peeviso , feeble tones to be far too large for him ; then cursed the glove - maker for a fool ; and so died .	1853	bl50258
gloves|of camphene	smelling		For the best of their Cavaliers now , smack strongly of the Chaumiere ; there are damaged hats with brims rolled close , â   unmistakeable medical tie of flashy cravat , and gloves smelling strono - ly of camphene ! Frequenters of Frascati , and the most elegant of Lorettes , are understood to be winding their way by dilio - ence and railroad , to Brussels , and the baths of Baden .	1850	bl50304
flowers|verbenas|velvet|petunias|fox - gloves|phlox|larkspurs|spiderwort|spiderwort	scented|scented	sweet|scented|scented	We have revelled in flowers growing growing under our windows and at our doors , which , with much tending , we have tempted to bloom meagerly in garden - borders and green - houses in New England , such as verbenas , â   velvet and sweet - scented , â   petunias , fox - gloves , phlox , larkspurs , spiderwort , spiderwort , etc .	1857	bl50315
the gloves of Cales|cloves|jessamine	smell|perfumes|perfumes		73 And the silken stuffs from Padua , that stand on end with their oaati richness ; what kntles and mantles they Avill make ! And the gloves of Cales , that cause the chamber to smell Like a garden full of spice , cloves , and jessamine ! And these veils from the Low Countries , as fine as a spider ' s web ! And the cloth of gold , and the cloth of silver , â   where did Master Eustace say they came from , Dame Margaret ? Margaret ? And this golden vessel for perfumes , perfumes , which looks like a basket all over - run with grapes and ivy ? That was wrought by a cunning goldsmith goldsmith of responded old Margaret , Margaret , skill is so surpassing , that , albeit he employs chiefly the precious metals , the workmanship is of more value than the materials .	1854	bl50591
the|the gloves	perfume|scent	very strong	Methinks the gloves have a very strong perfume , The scent whereof doth make my head to ache .	1850	bl50624
