Smell_Source	Smell_Word	Quality	Sentence	year	Book
Old Ling|Po|Ladies|comfits|fublunary|fcented Gloves|flunking Gonorheas|Harts - Horn Bottles	odoriferous|odoriferous|Perfumerâ|Perfumerâ	odoriferous|odoriferous|Perfumerâ|Perfumerâ	When the promifcuous Variety were thus met together , efpecially on a Summerâ   s Day , when the Pleat of the Weather requir ' d Air more than Ex - ercife , fuch an unfavoury Mixture of contrary Scents arofe from powderâ   d Locks , and plaiflerâ   d Ulcers ; perÂ ¬ fumâ   d Snufhes , and flunking Breaths ; fweaty Socks , and Hungary - Water Handkerchiefs ; rotten Old Ling , and odoriferous Po ? natu ? ns ; Fidlers Farts , and Ladies fweet Bags ; Brandy Belches , and Caraway - comfits ; fublunary Fumes , and fcented Gloves ; flunking Gonorheas , and Harts - Horn Bottles ; that the Noflrils of the Company were at once faluted with all the Eflences of a Perfumerâ   s Shop , and all the Stenches of an HofpitaL No fick Man ' s Chamber , when a hard hound Stool Idas eas ' d his Brain , and does his Body cool , Whilft Nurfe with jtaming Rofemâ   ry does difguife * 7he riaufeous Fumes that from the Pan arife .	1756	jw287434
Gloves	perfumes		154 Gloves , perfumes for .	1856	jw282358
Recent foxglove leaves|they	odour	slight narcotic	â   Recent foxglove leaves are inodorous ; but in the dried state they have a slight narcotic odour , and a bitter nauseous taste .	1833	jw282686
of the foxglove	odour	faint	The faint odour and nauseous bitter taste of the foxglove are covered by the spirit of cinnamon in these infusions , which are clear , and of a brownish - yellow colour .	1833	jw282686
gloves|PERFUME	perfuming|perfume		They are interesting as showing their connexion with the art of perfuming gloves , and 99 THE MYSTERY AND LURE OF PERFUME are represented by three red gloves and a gold perfume box or cassolette .	1927	jw282847
gloves	perfuming|perfumes		The art of perfuming gloves began to be practised early in the sixteenth century , and was carried on by the merchants , masters , and glove perfumers who obtained the right to make them and also to sell perfumes .	1927	jw282847
leather jerkin|pair|gloves	perfume|perfumed|perfumed|perfumed|perfumed|perfume	perfumed|perfumed|perfumed|perfumed	Stow records that â   Mil - loners or haberdashers had not then any gloves imbroyered or trimmed with gold or silke ; neither could they make any costly wash or perfume , until about the fifteenth year of the Queen [ Elizabeth ] when the Right Honourable Edwarde de Vere , Earl of Oxford , came from Italy , and brought with him , gloves , sweet bags , a perfumed leather jerkin and other pleasant things ; and that year the Queen had a pair of perfumed gloves trimmed only with four tuffes or roses of coloured silks ; the Queen took such pleasure in those gloves , that she was pictured with those gloves upon her hands , and for many years after it was called the Earl of Oxfordâ   s perfume .	1927	jw282847
gloves|Gloves|Bugle bracelet|necklace	perfumed|perfumed|Perfume	perfumed|perfumed	â   The perfumed gloves so often used in the six - 125 THE MYSTERY AND LURE OF PERFUME teenth century are mentioned by Autolycus in â   The Winterâ   s Taleâ   as follows : Gloves as sweet as damask roses ; Masks for faces and for noses ; Bugle bracelet , necklace amber , Perfume for a ladyâ   s chamber .	1927	jw282847
156|96 France|99 Frangipani|flower|gloves|story of|97 Frankincense|Balsam|Fumigating pastilles|Fumigations|incense|180 Gillyflower|Ginger - grass|Glove|Gold and frankincense offering|Greek|love of flowers|bath|perÂ ¬ fumes|fumes|from the flowers|14 Habenaria bifolia|Hair powder|flowers|Holland|bulbs|Honey Water|146 Horse - shoe vetch|158|Iris|rosemary|Japanese|Jasmine|parfumee|Lamas|incense	odorous|odorous|perfume|perfumes|perfume|perfume|perfumes|perfumed|perfumed|fumes|fumes|perfumes|perfumes|perfumes|perfumes|perfumes|perfume|fumes|perfume|smelling|perfumes|odorous|odorous|perfume|perfumes|perfumes|perfumes|perfume|perfume|perfumes|odours	odorous|odorous|dry|perfumed|perfumed|sweet|odorous|odorous|Holy|Lasting	France , 154 in sick - rooms , 138 odorous in sunshine , 156 offered to the dead , 76 that yield their perfume at night , 156 used for garlands , 71 Fra Angiolo Paladini , 96 France , perfumes of , 99 Frangipani , 97 flower , 98 gloves , 98 story of , 97 Frankincense offered to Bel , 24 Friarâ   s Balsam , 178 Fumigating pastilles , 58 Fumigation for plague , 135 to drive away demons , 51 Fumigations and incense , 9 24I INDEX Gabrielle dâ   Estrees , 102 Galbanum , 9 Garden of Eden , 3 Genetic functions , 219 Geranium oil , 180 Gillyflower esteemed by the Arabs , 36 perfume of the Greeks , 63 Ginger - grass perfume , 69 Glove - making in France , 109 Gold and frankincense offering , 9 dust for the hair , 227 â   Golden Rose , â   98 blessed by the Pope , 98 Great Plague of London , 134 Greek dry perfumes , 24 love of flowers , 71 perfumed bath , 72 perfumersâ   colouring for perÂ ¬ fumes , 64 perfumes for clothes , 65 perfumes for wine , 74 perfumes made from the flowers , 65 pot - pourri , 74 unguents for the head , 69 Greeks and cosmetics , 227 great liking for perfumes , 59 Griquasâ   method of adornment , 235 Grocersâ   Company , 89 Guests anointed with perfumes , 14 Habenaria bifolia , 156 Hair powder , 127 Hatsepsu , Queen of Egypt , 22 Expedition to Punt , 22 gifts for , 22 Headache caused by perfume , 65 Healing essences , 75 Hebrew women and use of cosÂ ¬ metics , 226 Heliogabalusâ   s love of perÂ ¬ fumes , 83 passion for roses , 83 Heliotrope , 181 Heliotropin , 209 Henry VIIIâ   s perfume , 163 Herba Bella donna , 230 Hesperis tristes , 156 242 Hindu marriage ceremony , 39 sweet - smelling flowers , 40 worship , perfumes offered , 39 History of Prince Arthur , 131 Holland , odorous bulbs , 155 â   Holy anointing oil , â   43 â   Holy perfume , â   43 Homer refers to perfumes , 59 Honey Water , 146 Horse - shoe vetch , 158 Houris , 32 Plungary Water , 140 tradition of its origin , 140 Imperial Water , 146 Incense and prayer , 52 early use by the Hebrews , 46 how it was compounded , 50 how it was offered , 48 , 50 origin of its use , 51 recipe for making , 58 sticks , 54 Incense used by ancient MexiÂ ¬ cans , 55 by Babylonians , 50 by Buddhists , 54 by Chinese , 55 by Egyptians , 48 by Jains , 54 by Japanese , 55 by Romans , 53 in ancient Greece , 52 in Christian Church , 56 in Churches of Rome , 57 in India , 53 India , perfumes used in , 38 Indian Nard , 46 Indians of Thompson River , 51 Iris , 184 of Elis , 66 Italy famous for its perfumes , 96 Izaak Walton , 122 Jabir - Ibn - Hayyan , 30 James I orders floor to be rubbed with rosemary , 148 Japanese perfume , 42 Jasmine , 40 , 181 Jewish Kings anointed , 43 Jews trade in spices , 43 Jinko , 42 INDEX â   Jockey Club , â   171 Judith , 44 Juniper , 8 smoke to sweeten rooms , 127 Juvenal on cosmetics , 84 Karnak , inscription on walls , 12 Kei Islandersâ   fumigation to drive demons away , 51 Khaleefeh El - Mutawekkel , 33 monopolises the rose , 33 King and Queen of Hanover , 167 King Edward Iâ   s offering , 9 King of El - Heereh monopolises the anemone , 36 King George IVâ   s perfume bills , 167 perfumes , 166 King Richard I , 159 King William IV , 167 Kohl , 225 Krishna , 177 Kyphi , 9 , 16 , 21 Damocratesâ   recipe for , 17 fame of , 16 offered to Ra , 50 recipes for making , 16 , 17 Kypros , 63 La Cour parfumee , 106 Lamas of Tibet , incense used by , 55 Lasting odours , 63 .	1927	jw282847
Lavender|Liquid myrrh|Lupin seeds|of patchouli|Lychnis vespertina|incense|Marie|Marie|Marjoram|unguents|Mattiac balls|Medes|fumes|Methyl|incense|incense|Nardinum|Nardostachys|Negroes|Neroli|Nitro - benzene|Noorjeehan|of Rose|244|arbor tristes|Odin the spicer|of sanctity|Oil of Niobe|of Redde Dog|Olibanum|Onycha|9 Onyx perfume|perfume|68 Opoponax|Orange - flower oil|Orchidee|the|Patches|Indian shawls|57 cigarettes|150 foods|roses|Petit|oil of|Petunias|Philadelphus coronarius|Philippine Island perfumes|perfumes|Philonides|of|Pitch|faggots|216 Plumiera alba|Powder|lip|gloves|Rhodium oil	perfumes|fumes|perfume|perfumes|perfumes|Perfume|Perfume|perfumed|perfumed|perfume|perfumes|perfumes|odours|perfumes|perfumes|perfumes|Odour|Odour|Odours|perfume|perfume|perfumes|perfuming|breath|perfume|Perfume|Perfume|Perfume|Perfumed|Perfumed|Perfumed|Perfumer|Perfumers|Perfumes|perfumes|perfumes|odour|odours|perfume|perfumes|snuff|fume|perfumes|perfumed|perfumed|perfumed|perfumed|perfumes|perfume|perfume|perfumes	perfumed|perfumed|Nubian|Olfactory|INDEX|Pleasurable|Polynesian|perfumed|perfumed|perfumed|perfumed|Quince	Lavender cultivation in EngÂ ¬ land , 141 earliest allusions to , 141 for linen , 122 Lavender Water , 142 as medicine , 115 early recipe , 115 recipe , 142 Lavender - sellerâ   s cry , 143 Law introduced against patches , proposed against the lure of perfumes , 151 Layardâ   s description of Garden of Eden , 4 Lemery and civet , 204 Letters fumigated during the Plague , 135 â   Life Elixir , â   96 Lilac , 182 Linalol , 210 Lip - stick , composition of , 232 Liquid myrrh , 8 London spicers , 90 Lord John Russell , 168 Lord Palmerston , 168 Louis XIV and his love of perÂ ¬ fumes , 105 Lupin seeds for the skin , 85 Lure of patchouli , 222 of perfume , 219 of red hair , 220 Lychnis vespertina , 156 Madame de Pompadourâ   s bills for perfumes , 106 Madame Tallienâ   s bath , 108 Maiden plum , 157 Maimonides and origin of inÂ ¬ cense , 47 Malays of Johore , incense used by the , 52 Marie Antoinetteâ   s perfumes , 106 â   Marie Antoinette â   Perfume , 160 â   Marie Josephine â   Perfume , 160 Marjoram from Kos , 66 Marquesas Islandersâ   cosmetics , 237 Martial on â   golden hair , â   229 on perfumed unguents , 86 â   Mattiac balls , â   229 Medes , love of perfume , 28 Medicinal properties of perÂ ¬ fumes , 66 Megaleion and its composition , 64 Megallus , Greek perfumer , 67 Mendesium , 17 , 67 composition of , 17 Mercutio Frangipani , 97 Methyl anthranilate , 209 benzoate , 210 Metopian , 17 , 66 Mignonette , 182 2 43 INDEX Miltonâ   s description of Garden of Eden , 3 Mohammedâ   s favourite flower , 34 love of perfumes , 31 Monastic gardens , 95 â   Moonlight of the Grove , â   40 Mosque at Kara Amed , 32 of Zobaide , 32 Mouse mushroom , 157 Musk , 193 antiquity of , 195 artificial , 210 in medicine , 198 Musk pods , 195 caddy , 196 â   catty , â   196 how collected , 195 Musk - cat , 193 Musk - deer , 196 hunting the , 196 Muskone , 198 Muslims of India , incense used by , 54 Myrrh , 7 , 8 , 182 earliest record of , 8 how collected , 182 Myrtle , rival to the violet , 35 Mysteries of Osiris , 23 Nahuas , incense used by , 56 Napoleonâ   s fondness for Eau de Cologne , 164 perfumerâ   s bills , 164 , 165 perfumes , 164 Nardinum , 82 Nardostachys , 46 Native fondness for odours , 238 Negroes , fondness for perfumes , 234 Neroli , 183 origin of name , 183 Neroâ   s love of perfumes , 78 Nicolas de Montant , 104 Nicostratus , 72 Ninon de Lenclos , 106 Nioi - bukooroo , 42 Nitro - benzene , 206 Noorjeehan Begum , 39 discovers Attar of Rose , 40 Norton , Thomas , 92 Nubian perfumes , 235 244 Nyctanthes arbor tristes , 156 Odin the spicer , 90 Odour , conveyance of , 217 â   Odour of sanctity , â   130 Odours and colours , 156 as medicinal agents , 133 effect on animals , 221 of animal origin , 205 that nauseate , 216 that recall places , 215 Oil of Niobe , 210 of Redde Dog , 119 Old ledger of a Court perfumer , 167 Olfactory nerves , 212 Olibanum , 7 , 179 how collected , 180 Omeltschenkiâ   s experiments , 139 Onycha , 9 Onyx perfume bottles , 68 Opoponax , 184 Orange - flower oil , 183 Orchidee , 209 â   Ordinall of Alkimy , â   92 Orris root , 184 Ovid alludes to floral offerings , 78 on beautifying the complexion , 85 Panathenaicum , 66 Paradise , description of , in Koran , 31 Paradise of Sumer , 7 Paris , sellers of perfumes , 99 Pastilles for perfuming the breath , 12 Patches , origin of , 232 Patchouli , 38 , 185 as perfume for Indian shawls , 186 Patents granted to perfumers in France , 99 Peau dâ   Espagne , 160 Pepperers of London , 88 â   Pepys letters , â   96 Perfume against plague , 121 bellows , i27 _ for â   any Prince , â   121 for King Henry of France , 116 for the chamber , 120 INDEX Perfume found in TutankhÂ ¬ amenâ   s tomb , 20 analysis of , 20 Perfume lamp , 120 necklace , 118 of a library , 147 of a toilet shop , 219 of Horus , 23 origin of word , 48 pan , 125 rings , 118 Perfumed bags , 11 5 candles , 57 cigarettes , 150 foods and sweetments , 13 Perfumed gloves , 99 for ye King , 109 introduced into England , no Perfumed pie , 32 skins , 109 Perfumer in London in sevenÂ ¬ teenth century , 91 Perfumersâ   advertisements , 152 immunity from cholera , 60 Perfumers of Paris , 99 Perfumes buried with the mummy , 23 for snuff , 148 for the breath , 66 for the wrist , 69 for tobacco , 149 in cookery , 32 in the gymnasium , 26 in the Stuart period , 121 men like , 222 _ offered to Deities , 60 that affect emotions , 221 to purify the body , 36 used at Roman banquets , 83 used by the Greeks , 63 women like , 222 Peron , Greek perfumer , 67 Perry , 152 Persians , their love for roses , 27 Petit Grain , oil of , 184 Petunias , 156 Philadelphus coronarius , 158 Philippine Island perfumes , 236 Philonides , 71 Physical explanation of the â   odour of sanctity , â   131 Piperonal , 209 Pitch and faggots burnt in the streets , 135 Pleasurable odours , 216 Plumiera alba , 98 Poisoned by perfume , 104 Polynesian perfumes , 236 â   Pomade Divine , â   231 Poppoeaâ   s bath of assesâ   milk , 84 funeral , 78 â   Poudre a la Marechale , â   105 Powder and patches , 232 Powder - puff and lip - stick , 231 Precious unguents , 18 Prince of Condeâ   s snuff , 105 Princess Charlotte , 167 Princess Esterhazy and perÂ ¬ fume , 166 Psagdi , 17 , 72 Public fountains perfumed , 104 Punt , 10 , 11 Qamâ   ey ointment , 17 Queen Alexandra , 168 Queen Elizabeth of Hungary , 140 Queen Elizabethâ   s fondness for perfumes , m perfumed cloak , 111 perfumed gloves , no perfumes , 163 still - room , in Queen Olga of Greece , 168 Queen Victoria , 168 Queen of Wurtemburg , 167 Quince perfume , 63 Rabbardâ   s letter to Queen ElizaÂ ¬ beth , 112 Recipe books , 116 for a perfume , first , 7 Rene the Florentine perfumer , 100 Reneâ   s shop in Paris , 100 description of , 100 Reseda , 182 Rhazes , 30 Rhodium oil , 186 Richelieuâ   s belief in perfumes , 106 Roman Catholics and use of inÂ ¬ cense , 57 dentifrice , 228 depilatory , 228 2 45 INDEX Roman Catholicsâ   ( cont .	1927	jw282847
it|gloves|hair|its	scented|scented|essence	scented|scented	Our perfumers ( 1783 ) add it to scented pillars ( ! ) candles , balls , or bottles , gloves and hair - powder ; and its essence is mixed with pomatum for the face and hands , either alone , or with musk .	1876	jw285721
foxglove|lily|wild thyme|water - mint|marjoram	scents|smell	most disagreeable	Among the scents figure foxglove , lily , wild thyme , water - mint , and marjoram , everyone of which , when rubbed on the skin , produces a most disagreeable smell .	1879	jw285908
with the foxglove	aromatics		The necessity of the union is sufficiently perceived , by joining aromatics with the foxglove .	1809	jw2815542
silks|ribbons|fans|washes|powder|patches|jessamine gloves|raliria	perfumes		As for her expences , no arithmetic can reach them ; sheâ   s always longing for something dear and useless , she will certainly ruin me in china , silks , ribbons , fans , laces , perfumes , washes , powder , patches , jessamine gloves and * raliria .	1839	jw2815688
mirrors|gloves|water	perfumed|perfumed|scented|scented	perfumed|perfumed|scented|scented	I have Venetian mirrors ^ Genoese wash - balls , perfumed gloves from Rome , and scented water from Naples .	1815	jw2815727
Jafminus|Gdfemimm|the Flowers|Gloves	perfume|ufed		Jafminus , or Gdfemimm , jefla - min ; the Flowers are chiefly ufed to perfume Gloves ; the Oil of it heals , mollifies , and opens , and is ufed in contra & ions of the Limbs , and the like .	1726	jw284283
GLOVES	Perfume		GLOVES , Perfume for .	1868	jw2914384
Gloves	Perfume		Gloves , Perfume for , 114 .	1847	jw291795
Foxglove	odour	slight|peculiar	Foxglove has a slight odour which is peculiar , and hag an unpleasant bitter taste .	1911	jw291949
Glass|Cardboard|Wrapping Papers|Gilt|China|Cups|dozen large Glass Puff Bowls|200 dozen Menthols|Glass|Bottle|dozen Nurses ' Nail Scissors|Stock of unfinished Sponge|Caps|Gloves|Finger Stalls	Perfume|Perfume|Smelling		, Toilet and Manicure Sets and Requisites , expensive Sur - gical Instruments , large stock of Bone Soother Mounts , 200 gross Corn Solvent Bottles and Corks , Nasal Inhalers , Glass and other Syringes , Showeards , Cardboard Boxes , Wrapping Papers , Gilt Tops for Perfume iSprays , all ! kinds of Douche Cans , 100 dozen Tboth Creams and Paste , large quantity , of Glass Chemists ' Sundries , 200 pairs American Split Wood Crutches , China Spitting and Shaving Mugs and Feeding , Cups , 7 dozen large Glass Puff Bowls , 200 dozen Menthols , Glass Perfume and Smelling Bottle , 250 dozen Nurses ' Nail Scissors and Clippers , Stock of unfinished Sponge Bags , Bathing Caps , Washing Gloves , Finger Stalls , etc .	1916	jw2911109
Gloves|Fans|Tobacco|it	Cleanfing|Perfuming		With the manner of Colouring and Scenting Gloves and Fans , and Cleanfing Tobacco , and Perfuming it â  ¢ , for all Kinds of Snuff .	1703	jw2911202
specimens|such pills|of hemlock and foxÂ ¬ glove|of these vegetables	odour	characteristic	I have deposited in the cabinet of the College , specimens of such pills , of hemlock and foxÂ ¬ glove , which retain the characteristic odour of these vegetables , notwithstanding they have been now made for several years .	1829	jw2917080
flowers|substances|gloves	smelling|odoriferous|odoriferous|perfumed|perfumed|scented|scented|smell|ing|odoriferous|odoriferous|perfumed|perfumed|aroma|perfume	sweet|frag|odoriferous|odoriferous|perfumed|perfumed|redolent|sweet|scented|scented|sweet|odoriferous|odoriferous|perfumed|perfumed|fragrant	sweet - smelling ; frag - rant ; odoriferous ; perfumed ; redolent ; sweet - scented ; â   7 á ¼  Î ½ Î ´ Î · , sweet - smell - ing flowers , â   svÂ ¢ Î ¿ á ½  Ï  Î ¯ Î ± Î ¹ , odoriferous substances ; - - - Î ® Ï  Î µ Î ¹ Ï  Ï  Î º Ï  Î ¹ Î ± , perfumed gloves ; â   eÂ ¢ á ¼  Ï  Ï  Î ¼ Î ± , a fragrant aroma ( or perfume ) ; â   y Ï  Î ¯ Ï  Î ± ( Ï  Î ¹ Î ¶ Î ­ Î » Î ¹ Î ± ) , sweet - peas .	1908	jw2917667
Gloves	perfume		109 ] To perfume Gloves CHAP .	1653	jw2910394
with Gloves|Bay - leaves|Lemon - pils	perfuming|perfume|fweet|fweet|fumes	deljcateft|fweet|fweet	This being burnt either upon a hot pan , or elfe boyled in perfuming pans with Gloves , Bay - leaves , and Lemon - pils , will make the moft deljcateft perfume that may be without any offence , and will la ft the longeft of all other fweet perÂ ¬ fumes , as hath been found by experience .	1653	jw2910394
Gloves|fweet AlÂ|Gloves|HE	perfume|perfume	excellently	To perfume Gloves excellently , take the oyle of fweet AlÂ ¬ monds , oyle of Nutmegs , oyl of Benjamin , of each a dram 3 of Amber - greece one grain , fat Musk two graines A mixe them all together , , and grind them upon a Painters ftone , and then ajinoint the Gloves therewith , yet befor & you annoirst , Â £ ' them To perfume Gloves * HE _ .	1653	jw2910394
gloves	perfume		"""foil of beanes , and parch them in a pan till they ' bur ft : then put them in as hot as you can into the ferkin , and flop it with a little clay about the bung - hole : then take a handtull ot clean Rye - Leaven and put in the fa kin ; then take a quantity ot batbirries , and bruifeand ftrainthem into the terkin , and a ' ' I 4 """" : good I if if ( m it â  ¢ if * ii ' 8i I I 2 To perfume gloves ."""	1653	jw2910394
Gloves	perfumed|perfumed|effluvia	perfumed|perfumed	Gloves , and many other perfumed articles , have been known to retain effluvia twenty - eight or twenty - nine years , and probably they retain - ed them many years longer .	1812	jw2912674
GLOVES	Perfume		GLOVES , Perfume for .	1902	jw2912758
with a bunch of grapes|of ^ pair of gloves	scent	venomous	Some say he was poisoned with a bunch of grapes ; others attribute it to the venomous scent of ^ pair of gloves presented to him ( the distemper lyint for the most part in the head .	1852	jw293434
Hair|gloves|shoes|breasts|lingerie|of the body	smell	fetishistic	Hair , gloves , shoes , breasts , lingerie , the smell of the body , the sight of the beloved and similar substitutions of a part for the whole may be the objects of fetishistic love , capable of evoking ejaculation or orgasm .	1932	jw293716
Recent foxglove leaves|they	odour	slight narcotic	â   Recent foxglove leaves are inodorous ; but in the dried state they have a slight narcotic odour , and a bitter nauseous taste .	1852	jw293755
the|bichloride|acetate|diacetate|carbonate|tartar|aqueous|aqueous infusions|decoctions of chamo - mile flowers|calumba|cascarilla|horse - radish|cloves|catechu|orange - peel|foxglove|senna|rhubarb|valerian|simaruba|elm	aqueous|aqueous		It affords precipitates with the alkaline carbonates , lime - water , the salts of iron , and of zinc , nitrate of silver , bichloride of mercury , arsenious acid , acetate and diacetate of lead , carbonate of potassa , and tartar emetic ; the aqueous infusions and decoctions of chamo - mile flowers , calumba , cascarilla , horse - radish , cloves , catechu , orange - peel , foxglove , senna , rhubarb , valerian , simaruba , and elm bark .	1852	jw293755
of the foxglove	odour	faint	The faint odour and nauseous bitter taste of the foxglove are covered by the spirit of cinnamon .	1852	jw293755
pastilles|whey|79 foxglove|219 lobelia|304 opium|341 prophylactic|79 rosemary|401 roses|compound|401 sage|408 squill|422 stavesacre|443 Vinegars|Violet|468 conserve|468|468 oil|468 syrup|468	aromatic|aromatic|aromatic|aromatic	aromatic|aromatic|aromatic|aromatic|hysteric|hysteric	"""464 wine , 464 Valerianate of iron , 243 quinia , 393 soda , 440 zinc , 475 Valerianic acid , 88 , 465 Vallet ' s mass , 230 VanUIa , 465 arrowroot , 465 essence , 466 extract , fluid , 466 lozenges , 465 milk , 466 powder , saccharated , 406 spirit , 465 sugar , 465 tincture , 465 Vapor bath , 538 Varnishes , 486 Varnish , amber , 486 copal , 486 crystal , 313 furniture , 486 Japan , 486 lac , 486 leather , 486 metal , 486 picture , 313 Veal tea , 488 Vegetable broth , 487 Venesection , 547 Ventilation of sick room , 55 Veratria , 466 Veratria , liniment , 466 lotion , 466 muriate , 467 nitrate , 467 ointment , 466 with iodine , 467 opium , 467 pills , 466 â   with henbane , 466 sulphate , 467 solution , 467 tincture , 466 Verdigris , 212 Vermifuge sugar , 406 Vesioatories , 69 , Vinegar , 77 cataplasm , 78 distilled , 73 gargle , 78 mixture , 77 and csirdamom , 77 pastilles , 87 syrup , 78 whey , 295 aromatic , 78 , 401 spirit , 78 borax , 434 camphorated , 79 cantharides , 164 Cayenne pepper , 168 cinnamon , compound , 193 coffee , 195 colohicum root , 197 seed , 197 elder flowers , 408 four thieves , 79 foxglove , 219 lobelia , 304 opium , 341 prophylactic , 79 rosemary , aromatic , 401 roses , compound , 401 sage , 408 squill , 422 stavesacre , 443 Vinegars , 524 Violet , 468 conserve , 468 honey , 468 oil , 468 syrup , 468 Virginia snakeroot , 428 Vocabulary of words used in prescriptions , 44 Volatile oUs , 528 """" Wakaka , 152 Walnut , white , 291 Warm bath , 636 , 538 Ward ' s essence , 161 â   paste , 352 Warner ' s cordial , 397 tincture , 343 Wash , black , 277 cosmetic , 147 , 271 detergent , 99 ophthalmic , 213 w Wash , red iodide of mercury , 276 sal - ammoniac , 109 yellow , 270 Water , allspice , 351 ammonia , 103 anemone , 116 angelica , 117 aniseed , 118 anti - hysteric , 316 apple , 489 arquebusade , 317 650 GENERAL INDEX ."""	1858	jw293898
gloves	Perfumed		""""""" â   Perfumed gloves were articles of commerce , as is shown bv item """" 2 paire of ' weems Jasmine gloves """" in last full line of invoice reproduced above ."""	1940	jw296278
gloves|fans	perfumes		As a place to lounge in , to walk , and talk , and hear the news , as our American cousins say , the New Exchange succeeded to Paul ' s Walk ; but , with this difference , Paul ' s Walk was only used by gentlemen ; while the shops in the New Exchange being especially devoted to the sale of gloves , perfumes , fans , and other feminine necessities or luxuries , its walks were frequented by the gay and fashionable of both sexes .	1879	jw292349
specimens of such pills|of hemlock and foxglove|of these vegetables	odour	characteristic	I have deposited in the cabinet of the College , specimens of such pills , of hemlock and foxglove , which retain the characteristic odour of these vegetables , notwithstanding they have been now made for several years .	1828	jw292969
specimens|such pills|of hemlock and fox - glove|of these vegetables	odour	characteristic	I have deposited in the cabinet of the College , specimens of such pills , of hemlock and fox - glove , which retain the characteristic odour of these vegetables , not - withstanding they have been now made for several years .	1833	jw295152
glove	scent		â  ¢ The prostitution in cafes , scent shops , glove shops , etc .	1908	jw29109
GLOVES	Perfume		GLOVES , To Perfume .	1891	jw29975
